A2: 学 | B2: 项 | C2: 第 周 | AY2: 第 周 | BO2: 本月扣分合计 | BP2: 本学期扣分累计
B3: 成 | C3: 德 育 | O3: 体 育 | S3: 德 育 | AE3: 体 育 | AI3: 德 育 | AU3: 体 育 | AY3: 德 育 | BK3: 体 育
B4: 绩 目 | C4: 集体 活动 | E4: 上 课 | G4: 劳动、卫生 | K4: 纪 律 | M4: 态度 | N4: 扣 分 小计 | O4: 课间操 | P4: 早 操 | Q4: 活 动 | R4: 扣 分 小计 | S4: 集体 活动 | U4: 上 课 | W4: 劳动、卫生 | AA4: 纪 律 | AC4: 态度 | AD4: 扣 分 小计 | AE4: 早 操 | AF4: 课间操 | AG4: 活 动 | AH4: 扣 分 小计 | AI4: 集体 活动 | AK4: 上 课 | AM4: 劳动、卫生 | AQ4: 纪 律 | AS4: 态度 | AT4: 扣 分 小计 | AU4: 早 操 | AV4: 课间操 | AW4: 活 动 | AX4: 扣 分 小计 | AY4: 集体 活动 | BA4: 上 课 | BC4: 劳动、卫生 | BG4: 纪 律 | BI4: 态度 | BJ4: 扣 分 小计 | BK4: 早 操 | BL4: 课间操 | BM4: 活 动 | BN4: 扣 分 小计
A5: 号 | B5: 姓 名 | C5: 班团活动 | D5: 大会 | E5: 迟到早退 | F5: 违纪 | G5: 教室 | H5: 宿舍 | I5: 包干区 | J5: 值勤 | K5: 社会 公德 | L5: 校纪 校规 | M5: 不交作业 | S5: 班团活动 | T5: 大会 | U5: 迟到早退 | V5: 违纪 | W5: 教室 | X5: 宿舍 | Y5: 包干区 | Z5: 值勤 | AA5: 社会 公德 | AB5: 校纪 校规 | AC5: 不交作业 | AI5: 班团活动 | AJ5: 大会 | AK5: 迟到早退 | AL5: 违纪 | AM5: 教室 | AN5: 宿舍 | AO5: 包干区 | AP5: 值勤 | AQ5: 社会 公德 | AR5: 校纪 校规 | AS5: 不交作业 | AY5: 班团活动 | AZ5: 大会 | BA5: 迟到早退 | BB5: 违纪 | BC5: 教室 | BD5: 宿舍 | BE5: 包干区 | BF5: 值勤 | BG5: 社会 公德 | BH5: 校纪 校规 | BI5: 不交作业
A6: 1
A7: 2
A8: =A7+1 -> 3
A9: =A8+1 -> 4
A10: =A9+1 -> 5
A11: =A10+1 -> 6
A12: =A11+1 -> 7
A13: =A12+1 -> 8
A14: =A13+1 -> 9
A15: =A14+1 -> 10
A16: =A15+1 -> 11
A17: =A16+1 -> 12
A18: =A17+1 -> 13
A19: =A18+1 -> 14
A20: =A19+1 -> 15
A21: =A20+1 -> 16
A22: =A21+1 -> 17
A23: =A22+1 -> 18
A24: =A23+1 -> 19
A25: =A24+1 -> 20
A26: =A25+1 -> 21
A27: =A26+1 -> 22
A28: =A27+1 -> 23
A29: =A28+1 -> 24
A30: =A29+1 -> 25
A31: =A30+1 -> 26
A32: =A31+1 -> 27
A33: =A32+1 -> 28
A34: =A33+1 -> 29
A35: =A34+1 -> 30
A36: =A35+1 -> 31
A37: =A36+1 -> 32
A38: =A37+1 -> 33
A39: =A38+1 -> 34
A40: =A39+1 -> 35
A41: =A40+1 -> 36
A42: =A41+1 -> 37
A43: =A42+1 -> 38
A44: =A43+1 -> 39
A45: =A44+1 -> 40
A46: =A45+1 -> 41
A47: =A46+1 -> 42
A48: =A47+1 -> 43
A49: =A48+1 -> 44
A50: =A49+1 -> 45
A51: =A50+1 -> 46
A52: =A51+1 -> 47
A53: =A52+1 -> 48
A54: =A53+1 -> 49
A55: =A54+1 -> 50
A56: =A55+1 -> 51
A57: =A56+1 -> 52
A58: =A57+1 -> 53

A1: 班 级： 学 生 素 质 综 合 测 评 德育平 时考核 记 录 年 月

A1: 第 周

A1: 第 周